{
  "$id": "EIEe3CAVep2SfJFidtPJNwJtfEAwYt2SQ4vln2nl-rrf",
  "$schema": "https://json-schema.org/draft/2020-12/schema",
  "title": "Telephone Number Allocation Credential",
  "description": "Telephone Number Allocation credential proves an enterprise has the right to use (RTU) specific telephone numbers, either directly from a regulator or through a telephone number provider.",
  "type": "object",
  "version": "2.0.0",
  "required": [
    "v",
    "d",
    "u",
    "i",
    "ri",
    "s",
    "a",
    "r"
  ],
  "properties": {
    "v": {
      "description": "Version string using ACDC conventions, encoding protocol, serialization, and size.",
      "type": "string",
      "pattern": "^ACDC[0-9]{2}[A-Z]{4}[0-9a-f]{6}_$",
      "examples": [
        "ACDC10JSON000345_"
      ]
    },
    "d": {
      "description": "SAID of the credential (Blake3-256 digest in CESR compact encoding).",
      "type": "string",
      "pattern": "^E[A-Za-z0-9_-]{43}$",
      "examples": [
        "EBwNam2e0mYdTx0i9xv78AIm16g1XCkQO8f8yJXaxmJC"
      ]
    },
    "u": {
      "description": "A salty nonce (high-entropy random value) used to prevent rainbow-table attacks on the credential SAID.",
      "type": "string",
      "examples": [
        "0AHcgNghkDaG7ts1Bv8wkv3b"
      ]
    },
    "i": {
      "description": "AID of the issuer (the party asserting the telephone number allocation right).",
      "type": "string",
      "pattern": "^[A-Za-z0-9_-]{44}$",
      "examples": [
        "EDC0Sj0CPYd70zUSY2ehvm7Z4kwZigugiA84wuS7lK2H",
        "BCmx-dBiozRlK5MfRnznAHl9kmXjB3t-zxrE3hIIYkeS"
      ]
    },
    "ri": {
      "description": "SAID of the issuer's ACDC credential status registry.",
      "type": "string",
      "pattern": "^E[A-Za-z0-9_-]{43}$",
      "examples": [
        "EOkdwKgeEF-Ww2d61uhHjAo13rjJROdbdIaxORQJRV2G"
      ]
    },
    "s": {
      "description": "SAID of this schema (Blake3-256 digest in CESR compact encoding).",
      "type": "string",
      "pattern": "^E[A-Za-z0-9_-]{43}$",
      "examples": [
        "EI8g4_JZ0zA50yihhsb-RXvOEcsI8TSN7PJrNgIbAUH1"
      ]
    },
    "a": {
      "oneOf": [
        {
          "description": "Attributes block SAID",
          "type": "string"
        },
        {
          "$id": "EFC0ZCw01iPYBFdHHK3EaR_YZYOewvcf3GASJHd5MFBp",
          "description": "Attributes block",
          "type": "object",
          "required": [
            "d",
            "u",
            "i",
            "dt",
            "numbers"
          ],
          "properties": {
            "d": {
              "description": "SAID of the attributes block (Blake3-256 digest in CESR compact encoding).",
              "type": "string",
              "pattern": "^E[A-Za-z0-9_-]{43}$",
              "examples": [
                "EGgYbtyoE0qGfYfZWZ1lAd-UoWu_2OjqMcms_75s4atv"
              ]
            },
            "u": {
              "description": "A salty nonce for the attributes block, enabling selective disclosure.",
              "type": "string",
              "examples": [
                "0AHcgNghkDaG7ts1Bv8wkv3b"
              ]
            },
            "i": {
              "description": "AID of the credential recipient \u2014 the enterprise or individual that holds the right to use the allocated telephone numbers.",
              "type": "string",
              "pattern": "^[A-Za-z0-9_-]{44}$",
              "examples": [
                "EAZz0-cvLBLfqw3TRo-J0kBzM1TEwQ6a_v_892uH3Yjz"
              ]
            },
            "dt": {
              "description": "Issuance date-time (when the ACDC was signed), as an ISO-8601 datetime string with timezone.",
              "type": "string",
              "format": "date-time",
              "examples": [
                "2024-01-15T10:30:00.000000+00:00"
              ]
            },
            "numbers": {
              "description": "Array of number expressions representing telephone numbers allocated to the enterprise. Each expression is either a single E164 number (e.g., '+15551234567') or an inclusive range denoted by a hyphen between two E164 numbers (e.g., '+15551230000-+15551239999'). All numbers in a single credential must share the same granting authority.",
              "type": "array",
              "uniqueItems": true,
              "minItems": 1,
              "items": {
                "type": "string",
                "description": "A single E164 telephone number or an inclusive range. Single number: '+' followed by 7-15 digits. Range: two E164 numbers separated by a hyphen (e.g., '+15551230000-+15551239999').",
                "pattern": "^\\+[0-9]{7,15}(-\\+[0-9]{7,15})?$"
              },
              "examples": [
                [
                  "+15551234567"
                ],
                [
                  "+15551230000-+15551239999"
                ],
                [
                  "+15551234567",
                  "+442071234567"
                ],
                [
                  "+15551230000-+15551239999",
                  "+15558880000-+15558889999"
                ],
                [
                  "+15551234567",
                  "+15559876543",
                  "+442071234567",
                  "+81312345678"
                ]
              ]
            },
            "channel": {
              "description": "Optional list of communication channels for which these numbers are allocated. If omitted, no channel restriction is implied. Use 'sms' for A2P/P2P messaging, 'voice' for voice calls, or both to indicate dual-channel use.",
              "type": "array",
              "uniqueItems": true,
              "minItems": 1,
              "items": {
                "type": "string",
                "enum": [
                  "sms",
                  "voice"
                ]
              },
              "examples": [
                [
                  "voice"
                ],
                [
                  "sms"
                ],
                [
                  "sms",
                  "voice"
                ]
              ]
            },
            "startDate": {
              "description": "Optional start date from which the telephone number allocation is valid (ISO-8601). Useful for proving long-term continuous ownership of a number.",
              "type": "string",
              "format": "date-time",
              "examples": [
                "2020-06-01T00:00:00.000000+00:00"
              ]
            },
            "endDate": {
              "description": "Optional expiration date of the telephone number allocation (ISO-8601). If omitted, the allocation is considered open-ended and subject only to credential revocation.",
              "type": "string",
              "format": "date-time",
              "examples": [
                "2026-06-01T00:00:00.000000+00:00"
              ]
            }
          },
          "additionalProperties": true
        }
      ]
    },
    "e": {
      "oneOf": [
        {
          "description": "Edges block SAID",
          "type": "string"
        },
        {
          "$id": "EGymY-9Iie1aYzIT5_SN9OniMb4dJRSt0jzfOk57WRo6",
          "description": "Edges block",
          "type": "object",
          "properties": {
            "d": {
              "description": "SAID of the edges block.",
              "type": "string",
              "pattern": "^E[A-Za-z0-9_-]{43}$",
              "examples": [
                "ED-ETRO9FOiEgvK8P66Rut-Cun-0aZ5FbgTlngPf9yVT"
              ]
            },
            "tnalloc": {
              "description": "Chain to a telephone number allocation (RTU) credential that proves with a valid chain back to the regulator",
              "type": "object",
              "required": [
                "n",
                "s",
                "o"
              ],
              "properties": {
                "n": {
                  "description": "SAID of a parent telephone number allocation credential that grants the issuer the right to sub-allocate.",
                  "type": "string",
                  "pattern": "^E[A-Za-z0-9_-]{43}$",
                  "examples": [
                    "EBwNam2e0mYdTx0i9xv78AIm16g1XCkQO8f8yJXaxmJC"
                  ]
                },
                "s": {
                  "description": "SAID of the telephone number allocation schema that the chained credential must satisfy.",
                  "type": "string",
                  "pattern": "^E[A-Za-z0-9_-]{43}$",
                  "examples": [
                    "EI8g4_JZ0zA50yihhsb-RXvOEcsI8TSN7PJrNgIbAUH1"
                  ]
                },
                "o": {
                  "description": "Issuer-To-Issuee, operator indicating issuer AID of this ACDC MUST be the Issuee AID of the node this Edge points to.",
                  "type": "string",
                  "default": "I2I"
                }
              },
              "additionalProperties": false
            },
            "issuer": {
              "description": "Edge credential that proves the identity of the issuer.",
              "type": "object",
              "properties": {
                "n": {
                  "description": "SAID of a credential that proves the identity of the issuer (e.g., an OVC Org Identity or vLEI credential).",
                  "type": "string",
                  "pattern": "^E[A-Za-z0-9_-]{43}$",
                  "examples": [
                    "EG_rp79RWfT97mfVCiptp73PVKr26QHa-kAbMkTPqAno"
                  ]
                },
                "s": {
                  "description": "SAID of the schema that the issuer identity credential must satisfy.",
                  "type": "string",
                  "pattern": "^E[A-Za-z0-9_-]{43}$",
                  "examples": [
                    "ENPE4hUQ8Peu84tEcCni3koOQFOnBrDB0rg_at2NRhV9"
                  ]
                },
                "o": {
                  "description": "Not-Issuer-To-Issuee, operator indicating Issuer AID of this ACDC MAY or MAY not be the Issuee AID of the node that this Edge points to",
                  "type": "string",
                  "default": "NI2I"
                }
              },
              "additionalProperties": false,
              "required": [
                "n",
                "s",
                "o"
              ]
            }
          },
          "additionalProperties": true,
          "required": [
            "d"
          ]
        }
      ]
    },
    "r": {
      "oneOf": [
        {
          "description": "Rules section SAID",
          "type": "string"
        },
        {
          "$id": "EHrfdac4wurHKKoMsdBxgbYttUYXnsGVvmUL_J9xMJKt",
          "description": "Rules detail",
          "type": "object",
          "required": [
            "d",
            "governance"
          ],
          "properties": {
            "d": {
              "description": "SAID of the rules block.",
              "type": "string",
              "pattern": "^E[A-Za-z0-9_-]{43}$"
            },
            "governance": {
              "description": "Statement identifying the governance framework under which this credential was issued.",
              "type": "string",
              "examples": [
                "Issued under governance published at https://provenant.net/governance/tn-alloc/"
              ]
            },
            "noSharing": {
              "description": "No Sharing Disclaimer",
              "oneOf": [
                {
                  "description": "simple compact rule form",
                  "type": "string",
                  "default": "Issuees agree not to share or lend the allocated telephone number(s) to other parties in a way that would make it difficult to consistently identify the originator of traffic."
                },
                {
                  "description": "Rule detail",
                  "type": "object",
                  "properties": {
                    "l": {
                      "description": "Associated legal language",
                      "type": "string",
                      "default": "Issuees agree not to share or lend the allocated telephone number(s) to other parties in a way that would make it difficult to consistently identify the originator of traffic."
                    }
                  },
                  "required": [
                    "l"
                  ],
                  "additionalProperties": false
                }
              ]
            }
          },
          "additionalProperties": true
        }
      ]
    }
  },
  "additionalProperties": false
}