{
  "v": "ACDC10JSON000453_",
  "d": "EDUuuiM31svtBbgRuIk_3Ts0k7S23Iz9wD9voCSyoqOL",
  "u": "0AC8kpfo-uHQvxkuGZdlSjGy",
  "i": "EANghOmfYKURt3rufd9JNzQDw_7sQFxnDlIew4C3YCnM",
  "ri": "EDoSO5PEPLsstDr_XXa8aHAf0YKfPlJQcxZvkpMSzQDB",
  "s": "EJ9YoTJ81TcQ_pS9GmU2UbVURRm3ylnx_Wr1GbKjg0QP",
  "a": {
    "d": "EGSM6KZWVOXxmoNHlNNYBllu4DXs9Xx5-UhOnpTnDCO7",
    "u": "0ADSLntzn8x8eNU6PhUF26hk",
    "i": "EERawEn-XgvmDR_-2ESVUVC6pW-rkqBkxMTsL36HosAz",
    "dt": "2024-12-20T20:40:57.888000+00:00",
    "numbers": [
      "+1801361001-+1801361002",
      "+1801361005"
    ],
    "startDate": "2026-06-16T12:47:35.256840+00:00",
    "endDate": "2026-09-14T12:47:35.256840+00:00"
  },
  "e": {
    "d": "EHVafjATXqFvLkccHwmvjgNh-Yf-CoXoBCV35XVfa-EF",
    "tnalloc": {
      "n": "EG16t8CpJROovnGpgEW1_pLxH5nSBs1xQCbRexINYJgz",
      "s": "EJ9YoTJ81TcQ_pS9GmU2UbVURRm3ylnx_Wr1GbKjg0QP",
      "o": "I2I"
    }
  },
  "r": {
    "d": "EFC5aL2PUkGzu0BdKxWwL-jGkdqzKH8UQMrJg8T0HeYW",
    "governance": "Issued under governance published at https://provenant.net/governance/tn-alloc/",
    "noSharing": "Issuees agree not to share or lend the allocated telephone number(s) to other parties in a way that would make it difficult to consistently identify the originator of traffic."
  }
}